{
	"id": "pdf_tables_large",
	"category": "pdf",
	"description": "Large PDF with extensive tables to stress table extraction.",
	"document": {
		"path": "pdfs_with_tables/large.pdf",
		"media_type": "application/pdf"
	},
	"extraction": {
		"config": {}
	},
	"assertions": {
		"expected_mime": "application/pdf",
		"min_content_length": 500
	}
}
