{
	"id": "email_sample_eml",
	"category": "email",
	"description": "Sample EML email file to verify email parsing.",
	"document": {
		"path": "email/sample.eml",
		"media_type": "message/rfc822"
	},
	"extraction": {
		"config": {}
	},
	"assertions": {
		"expected_mime": "message/rfc822",
		"min_content_length": 20
	}
}
