{
	"id": "pdf_code_and_formula",
	"category": "pdf",
	"description": "PDF containing code snippets and formulas should retain substantial content.",
	"document": {
		"path": "pdfs/code_and_formula.pdf",
		"media_type": "application/pdf"
	},
	"extraction": {
		"config": {}
	},
	"assertions": {
		"expected_mime": "application/pdf",
		"min_content_length": 100
	}
}
