{
	"id": "pdf_simple_text",
	"category": "pdf",
	"description": "Simple text-heavy PDF should extract content without OCR or tables.",
	"document": {
		"path": "pdfs/fake_memo.pdf",
		"media_type": "application/pdf"
	},
	"extraction": {
		"config": {}
	},
	"assertions": {
		"expected_mime": "application/pdf",
		"min_content_length": 50,
		"content_contains_any": ["May 5, 2023", "To Whom it May Concern", "Mallori"]
	}
}
