{
	"id": "office_docx_lists",
	"category": "office",
	"description": "DOCX document emphasizing list formatting.",
	"document": {
		"path": "documents/unit_test_lists.docx",
		"media_type": "application/vnd.openxmlformats-officedocument.wordprocessingml.document"
	},
	"extraction": {
		"config": {}
	},
	"assertions": {
		"expected_mime": "application/vnd.openxmlformats-officedocument.wordprocessingml.document",
		"min_content_length": 20
	}
}
