{
	"id": "office_xlsx_basic",
	"category": "office",
	"description": "XLSX spreadsheet should produce metadata and content.",
	"document": {
		"path": "spreadsheets/stanley_cups.xlsx",
		"media_type": "application/vnd.openxmlformats-officedocument.spreadsheetml.sheet"
	},
	"extraction": {
		"config": {}
	},
	"assertions": {
		"expected_mime": "application/vnd.openxmlformats-officedocument.spreadsheetml.sheet",
		"min_content_length": 10,
		"metadata": {
			"sheet_count": {
				"gte": 1
			}
		}
	}
}
